start	end	text
3832520	3839240	about like there's a theta here um but there's no theta here anymore okay um so this y hat is
3839240	3845800	nothing else but xi times theta uh this is the estimation from the linear model this is the
3845800	3851320	linear model what it's doing uh and note that this is extremely matrix notation here right already
3851320	3856280	right so this one here is going over the training samples but this one here is one feature vector
3856280	3862440	times our vector of weights and this is a a vector this is a dot product here right
3862440	3868320	and this dot product because there's another sum here we can now go ahead and write write the whole
3868320	3874840	thing as a matrix notation right so we can write this square thing as the matrix notation um in
3874840	3881840	this case we know this one is now a matrix this is n training samples each has an input vector of
3881840	3886280	of d and this x here is written as a matrix basically all right so these
3886280	3892060	are our training samples here and here um and of course i'm assuming you know also this function
3892060	3898300	this is nothing else but the normal equation it's the same thing um and we also know that this y here
3898300	3903120	is our n label that we care about right so these ones we want to approximate this is a matrix this
3903120	3909560	is a vector this is also a vector right um we will talk a little bit about the matrix notation in the
3909560	3915300	exercise session um we understand a lot of people taking this lecture um well let's put it this way
3915300	3919600	the linear algebra course might have been a few semesters ago and we're happy to give a bit of a
3919600	3924980	refresher course here so you want to keep this course relatively easy to follow so we are actually
3924980	3930100	giving you um a bit of an intro on the matrix notation so if you were a bit struggling here
3930100	3937980	i would recommend maybe pause the video here and actually go and and check our our tutorial on the
3937980	3942700	matrix notation first um however at the same time for the rest of the sake of the video i'm assuming
3942700	3944400	that you know or at least have a basic
3944400	3945280	knowledge of the matrix notation so i'm assuming that you know or at least have a basic knowledge
3945280	3951340	of matrix notations okay all right so what does it mean well this is obviously a convex function
3951340	3956720	um this is the normal equation right um we know that from linear algebra um and we know that
3956720	3961380	there's an optimum and we know how to find the optimum and the way how we do find that optimum
3961380	3966900	is very straightforward um actually we have learned this already in high school in high
3966900	3970860	school we know if we have a quadratic function like this one this is a quadratic function it's
3970860	3975080	the normal equation um then we know that the gradient um
3975280	3979700	when the gradient is zero here we know that we have found a minimum or a maximum depending on
3979700	3984800	what shape the function is right but we have an extrema when the gradient is going to be zero
3984800	3993020	so how do we optimize that well um it's also relatively straightforward we just compute the
3993020	3998120	gradient of this matrix form right and if you're taking the gradient with respect to the thetas
3998120	4004060	that's what we care about these are our parameters we would like to solve for we end up with two times
4005280	4011540	x times theta minus two times x transpose times y and this should be equal to zero right this is
4011540	4017000	all constrained here so we're saying please find me the gradient with a finding point with the
4017000	4023080	gradient zero that's what we're setting here and the way we're finding that is it's xt times x
4023080	4030240	inverse times xty right and again you will notice this very rightfully this is this is the normal
4030240	4035260	equation right like if you if you bring this one here to the other side then you have xt times
4035280	4042780	x times theta is equal to xt times y which is our residual this is nothing else but a linear system
4042780	4049200	to solve right um there's a lot of a lot of things um i would love to give maybe a bit of
4049200	4055460	more intro on the algebra um this is the thing that i i unfortunately still experience even at
4055460	4059680	the phd level that people often struggling is how to solve systems like these ones right
4059680	4065260	um this is something that is very important like how do you even remember a matrix like this right
4065280	4069180	so in practice once you would never invert a matrix like this you would always use a linear
4069180	4075420	solver library especially when the matrix becomes large um there will be details in the exercise
4075420	4080300	session so again please look into this when you have any struggling with that i know there's a
4080300	4084680	bit of redundancy that's why i moved a little bit of stuff out here um to the exercise sessions and
4084680	4089900	i hope that you can catch up with the things you might have forgotten about linear algebra
4089900	4095020	okay um but assuming we can do that right we have found an
4095280	4101940	easy solution to a complex problem um what do we do here again well the inputs here are
4101940	4108840	our features like outside temperature number of people humidity um and on and this here on the
4108840	4114180	right hand side is our true output it's the temperature of the building and this is a least
4114180	4123460	squares estimate right um so there's this is not necessarily the best estimate but this is the
4123460	4125260	simplest estimate this is why we started
4125280	4131760	with this one um and there's a couple of different estimators here we're going to go through
4131760	4137600	um and each estimator has different properties right so for instance one thing what we have seen
4137600	4144640	here if you're taking a square term here you will see that if we're having one outlier in this least
4144640	4148820	squared estimate we will unfortunately have a bit of a problem because if we have one outlier
4148820	4154540	then unfortunately um yeah we might not be very robust to these outliers so for instance if you're
4154540	4155260	taking an l1
4155280	4161360	loss here instead of an l2 loss um then we might be a little bit more robust to outliers
4161360	4166960	unfortunately optimization becomes a little bit more tricky right so again also i hope that most
4166960	4171440	people know that i'm still going to repeat it a couple of times right if you're having an l2 loss
4171440	4175680	here it's a least squares estimate the optimum will always be the mean and if you have one
4175680	4181200	outlier the mean will shift quite a bit if you have an l1 loss for instance here the optimum
4181200	4185120	here will be the median and then if you have one outlier that will not affect the result that much
4185280	4192400	okay all right so let's talk a little bit more so this is basically an estimate we have done
4192400	4199420	based on an least square estimate now what i would like to do is i would like to talk about this
4199420	4205420	from a probabilistic standpoint and and this is a thing called maximum likelihood so it's very much
4205420	4212100	related um and we want to show why it's related um to our linear regression that we have just seen
4212800	4215080	so maximum likelihood is also a concept
4215280	4221600	you might have heard in your stochastic lectures already um but the core idea here is very specific
4221600	4227040	to machine learning meaning that what we would love to do is we would like to love to look at
4227040	4234720	some data um and this data has a certain distribution right so it might be a sequence of
4234720	4241280	numbers it might be a bunch of images it might be language right there's a true distribution right
4242000	4244000	um so given samples
4244640	4245280	this is basically
4245280	4251440	our true distribution here this is our data what we have right so we have here our uh what is our
4251440	4255680	respective value conditioned on the respective input right that's what we care about this is
4255680	4262720	what's in our data that's our true distribution that we would care about um and then what we have
4262720	4268400	is we have our model now our model we would like to mimic our data to some degree and i'm going
4268400	4274640	to talk about what this means by mimic it um so let's assume our model here is a parametric family
4274640	4282080	of distributions right so how is it parameterized well this is these these data parameters that's
4282080	4286320	what we've been talking about all the time right now right so these data parameters they are model
4286320	4293120	parameters what we would like to do is that these theta parameters make sure that our model right
4293120	4303120	now here um approximates basically our respective distribution and what a maximum likelihood
4303120	4304480	estimate is now saying is that
4305440	4311600	it's a method of estimating the parameters of a statistical model given the distributions
4312800	4319040	uh sorry given the observations so what we have we have here our model we were just defined what
4319040	4324640	we care about is the theta these are our model parameters um and now we have a bunch of
4324640	4332880	observations from our data right and what we would like to do now is we would like to find the parameters
4334880	4341040	that maximize the likelihood of making the observations given the parameters right so in
4341040	4345680	other words we want to make sure the model predicts what our observations say right that's
4345680	4351920	basically what it says so we would like to make sure that we're finding these parameters and in
4351920	4357600	a mathematical sense what that means is we would like to make sure we maximize the likelihood
4357600	4364000	that's why it's called maximize likelihood that the model matches whatever the true observations
4364000	4364480	are going to say
4364800	4370640	and since we're assuming right now this is a stochastic process this is why it's an estimate
4370640	4377040	and it's a likelihood estimate okay um now there's a couple of assumptions what we're making here
4377040	4380400	um and there's basically two two main assumptions
4381520	4388160	um so what we're assuming is that the maximum likelihood estimate assumes that the training
4388160	4393840	samples are independent and they're generated all by the same probability distribution we'll later
4393840	4394640	talk about which distribution is independent and they're generated all by the same probability
4394640	4399080	distribution it is but they're independent and they're from the same distribution and that's
4399080	4402480	important this is our assumptions what we're making with our maximum likelihood estimate
4402480	4408840	and assuming we say these are independent and this is very important now because assuming they're
4408840	4415800	independent for the sampling strategy this means all we have to do is we check our model we make
4415800	4421600	a prediction here basically every time that means we can simply multiply all of these predictions
4421600	4427080	from our model in other words none of the predictions have anything to do with each other
4427080	4431820	from a probabilistic standpoint right that's why we're assuming the samples that we're drawing from
4431820	4436540	our model right now they're independent and they're generated by the same probability distribution
4436540	4444480	okay so this is what we're assuming and now what we would like to do is we would like to go from
4444480	4451500	this abstract notion of please maximize the likelihood that my model matches
4451500	4451580	my model and that's what we're assuming and now what we would like to do is we would like to go
4451580	4452120	from this abstract notion of please maximize the likelihood that my model matches my observations
4452120	4459360	i would like to derive a loss function i would like to figure out how can we go from this
4459360	4465760	function here or from from this kind of abstract maximum likelihood estimate how can we go to a
4465760	4473460	loss function that we can then actually optimize in order to find the optimal parameters such that
4473460	4479500	our model is actually having the right status in order to match the observations with the highest
4479500	4481220	probability okay
4481580	4489800	so how do we do this well we want to simplify this term a little bit here and the big problem
4489800	4494100	what we're going to have here well let's call it a problem for now but we will find a solution
4494100	4500520	obviously um is this product this product makes this art max here kind of nasty to optimize when
4500520	4504680	if you're thinking about how you would optimize that it's not that straightforward but there's a
4504680	4510020	simple simple thing what we can do um so what we're going to do right now is we're going to go ahead
4510020	4511420	and just drawing the
4511580	4517780	logarithm so well looks strange right so what we're doing is we are basically going ahead and
4517780	4525100	saying here we have a product and here we have a sum but we have a sum of logarithms and this is
4525100	4532800	the nice thing about the the logarithmic property um if we're having a log a times b it's the same
4532800	4541500	as log a plus log b and you might say well okay that's fair so if you drew the logarithm
4541580	4548320	here um then you could do that but now you introduce just randomly logarithm in order
4548320	4554980	then to make this product here a sum but the trick here is that this is the logarithm is a
4554980	4562840	monotonic function so if we took the logarithm versus not the logarithm like the the monotony
4562840	4567560	is not violated because we we still have the highest probability of making the right prediction
4567560	4570300	or like to make the right prediction of the respective observations
4571580	4576680	this is a monotonic function we can very easily just draw the logarithm here and then rewrite this
4576680	4581520	product here as a sum right it's nothing complicated it's just applying this logarithmic
4581520	4585980	property and the reason why we can draw the logarithm is because this is a monotonic function
4585980	4592800	and the reason why we want to do that is this simplifies the whole problem quite a bit
4592800	4596600	like mathematically speaking if you're now going back to our linear regression
4596600	4601500	um and now what we can do is we can write this
4601580	4611200	as a sum instead of a um instead of a product um now we can actually look at what distributions
4611200	4617000	um or what probability distributions can our model have and this is our second assumption
4617000	4621540	what we're now making right now is we're saying well all of our models that we're doing
4621540	4628100	um following or all of our observations what we're what we're what we're looking at
4628100	4631420	they all fall follow a gaussian a gaussian distribution
4631580	4635180	so what shape does our probability distribution have well we're assuming it's gaussian
4635740	4644060	so assuming this is a normal distribution here um we having certain observations these are our y i's
4644060	4650140	right we're having our input features times our model parameters and we're having um the variance
4650140	4654940	here the standard deviation squared um and now what we can do is we can simply uh pull out the
4654940	4659340	mean here right so like here we have zero as our mean and we'll be pulling the mean out
4660140	4661580	and we're assuming this is our gaussian
4661580	4667740	so it's one over the square root of two pi um times sigma squared times e
4669260	4677020	to the power of minus one over two sigma squared times y i minus mu squared and we're assuming that
4677020	4684940	our y i's are drawn from this specific distribution right um and what we care about right now is we
4684940	4690380	would like to figure out what this term is here in the top what is the respective probability well
4691580	4694700	that's the thing where we can now go ahead and take this assumption
4695340	4701820	uh so what we've done here before right we have our our likelihood um and now what we can do is
4701820	4707180	we can simply go ahead and take this gaussian distribution and for this mu we're just feeding
4707180	4713260	in our xi theta right so all they're doing right now is we're simply assuming that our
4715260	4721260	our predictions our probabilities here they're gonna follow this gaussian distribution right so
4721260	4727340	all we're doing right now is we're just putting in our xi times theta we're putting this one into
4727340	4732700	our probabilities right now now right so you might say well okay this makes the term pretty
4732700	4737580	complicated but there's a little bit of an advantage where we just had because if we go
4737580	4743740	into our actual optimization problem we now know we don't have actual probabilities here we have
4743740	4750940	lot probabilities right so what we're trying to do here is we're saying our max over the sum of the
4751260	4756220	log probabilities from our model so now what we want to do is we want to put this one here back
4756220	4762060	into here and we're taking the logarithm of this whole gaussian here and this is a nice property
4762060	4767820	about the logarithm that this simplifies the whole problem quite a bit so the first thing what's going
4767820	4773820	to happen is so all i'm doing here right now is i'm putting this one into here this is my first
4775020	4778780	row here the first thing you're going to see is well okay we're taking the logarithm here
4779740	4781180	of this gaussian so
4781260	4785500	there's an e function right so the logarithm and the e function cancel out that's why the
4785500	4790940	logarithm is a pretty good choice here why we did this actually in the first place and then
4790940	4797100	the next thing what we can do is after so well first after we did that we will see here we
4797100	4805820	ending up with one constant here at the front so this one is two pi times sigma squared but
4805820	4811020	there's no x and no theta in here so there's no input and no model parameter in here the only
4811260	4816540	parameters are here um and then what we can do is we can just rewrite this whole thing as a matrix
4816540	4820540	and then this term already becomes a lot simpler right so now we have this constant here at the
4820540	4829820	beginning uh that's just a constant and now here we're having uh one over two sigma squared times
4830620	4836300	this uh well you guessed it it's a it's the same formula what we had before right it's
4836300	4841100	only the regression formula basically um okay and that's all we have right here
4841260	4847820	now right um so now what we want to do is if we want to have this log likelihood and we want to
4847820	4854060	have our r max here we're ending up with this formula how can we find the estimate of theta
4854060	4860300	well we've done this already we're setting we're looking for a linear least squares problem here
4860300	4864620	where we're setting the gradient to zero then we're ending up with our linear least squares
4864620	4869980	formulation and we try and solve that and then we're having our estimate for our maximum
4871260	4875340	likelihood estimate right so this is kind of a very important thing in machine learning that we
4875340	4882460	can kind of use this logarithm trick um in order to go from our maximum likelihood estimate um back
4882460	4886620	to our linear regression and using the same trick to solve it which is just the linear solve at the
4886620	4893020	end of the day okay um there will be some details here in the exercise session specifically regarding
4893020	4899180	the math i hope you could still follow it if it's a problem pause the video and go back and have a
4899180	4901100	look at the exercises first before you continue on the next one
4901260	4907500	so let's continue from here um but as a summary what we have been doing here um the maximum
4907500	4913980	likelihood estimator corresponds to the least squares estimate we've just derived that um
4913980	4917260	however of course we have to assume these assumptions right we had the assumptions that
4917260	4923260	our samples are drawn independent um and that they actually follow a quotient distribution
4923260	4925580	these were the two things and they're all the same distribution of course
4926300	4931100	um but what's important right now what we have done is we actually made quite a bit
4931260	4938540	of progress because now we have had an intro of linear regression and we had an intro of maximum
4938540	4945020	likelihood now we also have the concept of a loss function uh we have talked a little bit about
4945020	4951740	optimization to obtain the best model for regression um and we can do simple predictions
4951740	4958380	right now like the temperature in a room um but what we haven't talked too much about right now is
4958380	4960460	we haven't talked about our original task
4961260	4968300	our original task is this image classification task um and now the question is can we actually
4968300	4974140	do the same trick here also for classification right um so i wanted to reiterate the problem
4974140	4979180	statement here um i know some of the things here are redundant and i mentioned it already a little
4979180	4984940	bit between the slides so the regression versus the classification the difference here is very
4984940	4990540	obvious the the the difference is the regression predicts a continuous output like the temperature
4991260	4996380	of the room like you have a floating point value right whereas the classification predicts a
4996380	5003820	discrete value like a label um we can have a binary classifier like output is either zero one
5003820	5007420	or we can have a multi-class classification which is a set of n classes
5009580	5014540	right we're going to have a look at binary classification right now this is the the thing
5014540	5019740	that is well the next easy thing to look at um we're not going to talk too much about multi-class
5019740	5020860	classification today
5021260	5027340	in the next lecture um but this one is i think we want to now go from linear regression to the
5027340	5033100	analog of well i guess linear classification would be the main thing but it's it's not quite as simple
5033100	5039260	anymore and we want to talk about why it's not as simple anymore the whole method that we're going
5039260	5044140	to try to introduce here is called logistic regression and there's a reason why quote unquote
5044140	5050460	linear regression doesn't work that well for classification instead we have to do something
5050460	5051180	slightly different
5051260	5056780	this is what logistic regression is doing um so if we are starting with our linear classifier
5057740	5063660	what we would love to do is we would love to predict a probability we would like to make sure
5063660	5071340	which probability is it is it this class or is it that class now i mentioned this before a simple
5071340	5078460	way to approach this is we could just say well we do a linear regression and if my value is above
5078460	5081100	0.5 then it's class one
5081260	5087340	if it's below 0.5 then it's class 0. now the problem with that is there's nothing in our
5087340	5093900	linear regression that guarantees us that this value will between 0 and 1 and this is what we're
5093900	5099420	going to do right now we're going to simply go ahead and do a linear regression which is this
5099420	5107260	one here this linear regression here is doing nothing else x 0 times theta 0 x 1 times theta 1
5107260	5110860	x 2 times theta 2 sums it all up same thing as before
5111260	5116540	right so we have each feature vectors multiplied with one scalar technically we have we have a
5117180	5121260	we have a bias here at some point too it's a little inconsistent please forgive me about
5121260	5125180	that i but i wanted to make it a little bit easier from a from a writing perspective
5126540	5128860	and this is a score function right now
5130460	5138860	and we want to we want to just simply feed this output here into a sigmoid and this sigmoid of x
5141260	5149580	is 1 over 1 plus e to the power of minus x and the property of this function this function looks
5149580	5158380	like this so the point is that this function is between 0 and 1. it's never going to be 0
5158380	5164780	it's asymptotically approaching 0 and it's asymptotically approaching 1 right and the
5164780	5171180	idea of that is basically that we are squashing the output here between 0 and 1 such that we can
5171180	5177020	interpret it as a probability right and this is kind of convenient when it comes to classification
5177740	5184140	for instance if we're having a very high outlier here like if this linear classifier would predict
5184140	5190060	a very high outlier here it would simply squash it to 1. if it has a very low outlier it would
5190060	5195020	simply squash it to 0 and that is for classification a very desired property as we shall see
5196140	5201100	okay so what does it mean well um here for instance we
5201180	5206540	have the pro the way you would write this is what's the probability of my output being one
5207820	5213820	um for given input x given my model parameters data right that's what we couldn't scare about
5213820	5221340	like what's the probability that this is the one here um and a small spoiler alert here this is
5221340	5228380	basically a one-layer neural network right it's not a deep network um but it's a one-layer neural
